<?xml version="1.0" encoding="utf-8"?>
<xs:schema attributeFormDefault="unqualified" elementFormDefault="qualified" xmlns:xs="http://www.w3.org/2001/XMLSchema">
  <xs:element name="catalog">
    <xs:complexType>
      <xs:sequence>
        <xs:element name="articles">
          <xs:complexType>
            <xs:sequence>
              <xs:element maxOccurs="unbounded" name="article">
                <xs:complexType>
                  <xs:sequence>
                    <xs:element name="faculty" type="xs:string" />
                    <xs:element name="title" type="xs:string" />
                    <xs:element name="publish_date" type="xs:date" />
                    <xs:element name="isbn" type="xs:string" />
                  </xs:sequence>
                  <xs:attribute name="id" type="xs:string" use="required" />
                  <xs:attribute name="authorId" type="xs:string" use="optional" />
                  <xs:attribute name="categoryId" type="xs:string" use="required" />
                </xs:complexType>
              </xs:element>
            </xs:sequence>
          </xs:complexType>
        </xs:element>
        <xs:element name="authors">
          <xs:complexType>
            <xs:sequence>
              <xs:element maxOccurs="unbounded" name="author">
                <xs:complexType>
                  <xs:sequence>
                    <xs:element name="name" type="xs:string" />
                    <xs:element name="affiliations">
                      <xs:complexType>
                        <xs:sequence>
                          <xs:element maxOccurs="unbounded" name="affiliation" type="xs:string" />
                        </xs:sequence>
                      </xs:complexType>
                    </xs:element>
                  </xs:sequence>
                  <xs:attribute name="id" type="xs:string" use="required" />
                </xs:complexType>
              </xs:element>
            </xs:sequence>
          </xs:complexType>
        </xs:element>
        <xs:element name="categories">
          <xs:complexType>
            <xs:sequence>
              <xs:element maxOccurs="unbounded" name="category">
                <xs:complexType>
                  <xs:sequence>
                    <xs:element name="name" type="xs:string" />
                  </xs:sequence>
                  <xs:attribute name="id" type="xs:string" use="required" />
                  <xs:attribute name="type" type="xs:string" use="required" />
                </xs:complexType>
              </xs:element>
            </xs:sequence>
          </xs:complexType>
        </xs:element>
      </xs:sequence>
    </xs:complexType>
  </xs:element>
</xs:schema>